Index,Original Content,New Content,Removed Lines,ROUGE-1
508,"Not only is the beloved BTS singer Kim Seok Jin aka Jin a fan-favorite Korean artist but has been achieving a number of praise-worthy milestones with his musical achievements &nbsp;

Jin&rsquo;s The Astronaut makes him the first soloist ever to achieve Million Single Album certification on Circle Chart and KMCA

BTS&rsquo;s Kim Seok Jin becomes the first soloist in history to earn Million Single Album certification on Circle (Gaon) Chart and KMCA for his solo single album The Astronaut &nbsp;

Jin&rsquo;s The Astronaut will soon be the highest-selling K-pop soloist in Gaon (Circle) history

While the BTS member has delivered a myriad of hit songs, Kim Seok Jin&rsquo;s The Astronaut stands out with its global and local records  As of now, Jin&rsquo;s The Astronaut is merely 100,000 sales short of being the highest-selling K-pop soloist in Gaon (Circle) history &nbsp;

Kim Seok Jin - fastest K-pop soloist to cross a Million sales in South Korea

In fact, Kim Seok Jin has been the fastest K-pop solo artist to have managed to garner a million mark in sales in South Korea in merely 21 days of release &nbsp; As of now Jin&rsquo;s The Astraunaut is the second best-selling album by a soloist in history &nbsp;

Kim Seok Jin is also the only solo artist to have crossed the million mark with a single album  Other significant achievements by BTS&rsquo;s Jin include the biggest Spotify counter debut for a Korean Solo song (5 6 million), the fastest Korean solo song to reach 10M-70M streams on Spotify, and the biggest debut for a Korean Solo song on South Korea Spotify among several others &nbsp;


Stay updated with the latest Hallyu news on:&nbsp;Instagram,&nbsp;YouTube,&nbsp;Twitter,&nbsp;Facebook&nbsp;and&nbsp;Snapchat
ALSO READ: BTS's Kim Taehyung aka V becomes the 1st ever K-pop star to have TWO OSTs cross 200 million Spotify streams","kim seok jin is also the only solo artist to have crossed the million mark with a single album  other significant achievements by bts&rsquo;s jin include the biggest spotify counter debut for a korean solo song (5 6 million), the fastest korean solo song to reach 10m-70m streams on spotify, and the biggest debut for a korean solo song on south korea spotify among several others &nbsp;. in fact, kim seok jin has been the fastest k-pop solo artist to have managed to garner a million mark in sales in south korea in merely 21 days of release &nbsp; as of now jin&rsquo;s the astraunaut is the second best-selling album by a soloist in history &nbsp;.","not only is the beloved bts singer kim seok jin aka jin a fan-favorite korean artist but has been achieving a number of praise-worthy milestones with his musical achievements &nbsp;

jin&rsquo;s the astronaut makes him the first soloist ever to achieve million single album certification on circle chart and kmca

bts&rsquo;s kim seok jin becomes the first soloist in history to earn million single album certification on circle (gaon) chart and kmca for his solo single album the astronaut &nbsp;

jin&rsquo;s the astronaut will soon be the highest-selling k-pop soloist in gaon (circle) history

while the bts member has delivered a myriad of hit songs, kim seok jin&rsquo;s the astronaut stands out with its global and local records  as of now, jin&rsquo;s the astronaut is merely 100,000 sales short of being the highest-selling k-pop soloist in gaon (circle) history &nbsp;

kim seok jin - fastest k-pop soloist to cross a million sales in south korea

in fact, kim seok jin has been the fastest k-pop solo artist to have managed to garner a million mark in sales in south korea in merely 21 days of release &nbsp; as of now jin&rsquo;s the astraunaut is the second best-selling album by a soloist in history &nbsp;

kim seok jin is also the only solo artist to have crossed the million mark with a single album  other significant achievements by bts&rsquo;s jin include the biggest spotify counter debut for a korean solo song (5 6 million), the fastest korean solo song to reach 10m-70m streams on spotify, and the biggest debut for a korean solo song on south korea spotify among several others &nbsp;


stay updated with the latest hallyu news on:&nbsp;instagram,&nbsp;youtube,&nbsp;twitter,&nbsp;facebook&nbsp;and&nbsp;snapchat
also read: bts's kim taehyung aka v becomes the 1st ever k-pop star to have two osts cross 200 million spotify streams",0.5096153802144971
130,"At the special performance, Jisoo wore a red slit dress. Camila, on the other hand, extended support to Blackpink with her customised Born Pink outfit. The two shook a leg as they sang Liar. They were also spotted sharing hugs through the song and left Blackpink fans, aka, Blinks asking for more. Rosé further teased Jisoo and Camila for sharing ‘six hugges’ as she counted them. Later, Jisoo dropped a photo with Camila from backstage and captioned it, “Love youuu.” “It was so much fun singing with you @camila_cabello Thank you for making my stage shine even brighter! P.S. Your outfit made out of our tour merch was SO cute!” she also added. Camila's team also shared a BTS video where she said, “Blackpink in your area.” Reacting to the camaraderie, a happy fan wrote on Twitter, “The fact that jisoo is the first member in blackpink to perform a solo song with a western artist, and that she's also the first kpop singer to make a collab with CAMILA CABELLO is actually insane.” “Need them to collab,” added another one. Someone also mentioned, “Rosé counted the amount of hugs that jisoo and camila gave and wanted to hug jisoo too... i swear.” Blackpink members, Lisa, Jisoo, Rose and Jennie kickstarted their Born Pink tour in the US and have performed in Dallas, Houston, Atlanta, Chicago, Newark and Los Angeles so far. They will be finishing off their Born Pink concert tour in the US soon and will head towards places like North America, Europe, Asia and Australia, till late June 2023. They debuted in 2016 with their first album Square One and are currently promoting their latest album, Born Pink, which was released in September. Blackpink recently marked their comeback after two years of hiatus, when they focused on solo projects.","camila's team also shared a bts video where she said, “blackpink in your area.” reacting to the camaraderie, a happy fan wrote on twitter, “the fact that jisoo is the first member in blackpink to perform a solo song with a western artist, and that she's also the first kpop singer to make a collab with camila cabello is actually insane.” “need them to collab,” added another one. someone also mentioned, “rosé counted the amount of hugs that jisoo and camila gave and wanted to hug jisoo too... i swear.” blackpink members, lisa, jisoo, rose and jennie kickstarted their born pink tour in the us and have performed in dallas, houston, atlanta, chicago, newark and los angeles so far. they will be finishing off their born pink concert tour in the us soon and will head towards places like north america, europe, asia and australia, till late june 2023. they debuted in 2016 with their first album square one and are currently promoting their latest album, born pink, which was released in september.","they debuted in 2016 with their first album square one and are currently promoting their latest album, born pink, which was released in september. they were also spotted sharing hugs through the song and left blackpink fans, aka, blinks asking for more. later, jisoo dropped a photo with camila from backstage and captioned it, “love youuu.” “it was so much fun singing with you @camila_cabello thank you for making my stage shine even brighter! camila, on the other hand, extended support to blackpink with her customised born pink outfit. p.s. the two shook a leg as they sang liar. rosé further teased jisoo and camila for sharing ‘six hugges’ as she counted them. at the special performance, jisoo wore a red slit dress. they will be finishing off their born pink concert tour in the us soon and will head towards places like north america, europe, asia and australia, till late june 2023. your outfit made out of our tour merch was so cute!” she also added. blackpink recently marked their comeback after two years of hiatus, when they focused on solo projects.",0.5454545407785125
488,"January just became one of our favourite months of this year as a new collaboration was announced  BIGBANG fame, member Taeyang revealed and confirmed his upcoming song with Jimin of BTS and the fans of the two cannot stay calm  Here are all the details we know so far 

Taeyang X Jimin

On January 4, BIGBANG&rsquo;s Taeyang released a new teaser photo on his social media accounts, announcing his upcoming release  To be called &lsquo;VIBE&rsquo;, the song will drop on January 13 at 2 PM KST (10:30 am IST)  A collaboration between Taeyang and BTS&rsquo; Jimin, it is the first time that the members of the legendary groups are working together on a solo release &nbsp;

VIBE teaser poster

The teaser poster shared by Taeyang opens up in a yellow light setting where the two icons stand exuding their ever present charisma  The BIGBANG member, slightly bent from his waist is clad in a sleeveless jacket with multiple accessories around his neck and hands  His newly debuted long blonde hair is slicked back and it is one of the finest avatars we have seen him in &nbsp;

BTS member Jimin stands just behind him, propped on foot  Jimin&rsquo;s usual sensual presence is just as visible in this photo as he wears a shining leather jacket, loose black pants and chunky boots  The red and black theme is common on both the artists &nbsp;
Possibly, one of the most shocking collaborations to ever happen in the history of K-pop, &lsquo;VIBE&rsquo; marks the amalgamation of the long-riding skills honed by BIGBANG and its members within its fandom ever since their debut in 2006 and adds the massive influence of BTS and the septet&rsquo;s individual talents since their debut in 2013 to bring forth a groundbreaking release that will definitely make for a drop being talked about for years to come &nbsp;

Taeyang&rsquo;s change to THEBLACKLABEL

BIGBANG member Taeyang recently announced his departure from his origin agency, YG Entertainment, with whom he trained and debuted  Taeyang decided to move to THEBLACKLABEL, the subsidiary agency of YG Entertainment and revealed that he will continue to be a part of BIGBANG&rsquo;s future group activities  His move comes at a time when the renewal of contracts of the group&rsquo;s members is being discussed and with Daesung also deciding to leave their parent company, now only the leader, G-Dragon remains 

As soon as he shifted to his new agency, Taeyang revealed new profile photos which were also shared by him on his social media  He sported the same look as in the image for &lsquo;VIBE&rsquo;, making fans anticipate his upcoming release 

                                                                                    
                                                                                Taeyang teasing about VIBE

It was in early December of 2022, that the reports about Taeyang working with BTS member Jimin first broke out  While many found it hard to believe their eyes, others celebrated this unforgettable collaboration that was seemingly in the works  At the time, YG Entertainment responded with no confirmation and only asked fans to stay excited about the soloist&rsquo;s upcoming activities &nbsp;

&nbsp;

Just as his agency change was announced, Taeyang took to his Instagram to share a couple of photos  Captioning them &lsquo;#2023&rsquo;, it was obvious that the singer was raising the hype meter for his release  However, there was another person in the photos whose back was to the camera  Netizens turned on their detective sides and were quick to figure out that it was none other than BTS&rsquo; Jimin thanks to his hairstyle and adorable hands  The single was as good as confirmed now  To add to that, BTS member J-Hope clicked a like on the photo, which further solidified the fans&rsquo; thoughts &nbsp;

G-Dragon&rsquo;s support

Always the one to hype up his fellow members, BIGBANG leader G-Dragon shared a story on his Instagram account with THEBLACKLABEL&rsquo;s announcement of their new artist  He added a photo of himself and Taeyang to the mix, celebrating his fellow duo member&rsquo;s new start 
https://twitter com/fairyyeji_/status/1610383311834349568Daesung&rsquo;s letter&nbsp;

On the other hand, member Daesung who decided to leave YG Entertainment is yet to confirm his new agency  He wrote a handwritten letter to the label that has been with him right from the start and through all the highs and lows of his career so far and shared the letter through a video on his YouTube channel  He also added that &lsquo;BIGBANG is forever&rsquo;, confirming his participation in the group 
WE5Rxm4obGkJimin of BTS

This is not the first time that Jimin is collaborating with an artist outside of BTS  He has previously released a song, &lsquo;With You&rsquo;, with close friend Ha Sung Woon which was used as one of the OSTs for the K-drama &lsquo;Our Blues&rsquo;  He has also previously released solo songs, including those in BTS albums as well as &lsquo;Promise&rsquo; which was a gift for his fans 

&lsquo;VIBE&rsquo; drops on January 13 and we are so ready for it! Are you?

Stay updated with the latest Hallyu news on: Instagram, YouTube, Twitter, Facebook and Snapchat
ALSO READ: BTS: J-Hope talks about Jin calling from military on New Year’s Eve, BIGBANG’s Taeyang confirms Jimin collab?","on january 4, bigbang&rsquo;s taeyang released a new teaser photo on his social media accounts, announcing his upcoming release  to be called &lsquo;vibe&rsquo;, the song will drop on january 13 at 2 pm kst (10:30 am ist)  a collaboration between taeyang and bts&rsquo; jimin, it is the first time that the members of the legendary groups are working together on a solo release &nbsp;. bigbang member taeyang recently announced his departure from his origin agency, yg entertainment, with whom he trained and debuted  taeyang decided to move to theblacklabel, the subsidiary agency of yg entertainment and revealed that he will continue to be a part of bigbang&rsquo;s future group activities  his move comes at a time when the renewal of contracts of the group&rsquo;s members is being discussed and with daesung also deciding to leave their parent company, now only the leader, g-dragon remains . just as his agency change was announced, taeyang took to his instagram to share a couple of photos  captioning them &lsquo;#2023&rsquo;, it was obvious that the singer was raising the hype meter for his release  however, there was another person in the photos whose back was to the camera  netizens turned on their detective sides and were quick to figure out that it was none other than bts&rsquo; jimin thanks to his hairstyle and adorable hands  the single was as good as confirmed now  to add to that, bts member j-hope clicked a like on the photo, which further solidified the fans&rsquo; thoughts &nbsp;. january just became one of our favourite months of this year as a new collaboration was announced  bigbang fame, member taeyang revealed and confirmed his upcoming song with jimin of bts and the fans of the two cannot stay calm  here are all the details we know so far . it was in early december of 2022, that the reports about taeyang working with bts member jimin first broke out  while many found it hard to believe their eyes, others celebrated this unforgettable collaboration that was seemingly in the works  at the time, yg entertainment responded with no confirmation and only asked fans to stay excited about the soloist&rsquo;s upcoming activities &nbsp;.","are you? stay updated with the latest hallyu news on: instagram, youtube, twitter, facebook and snapchat
also read: bts: j-hope talks about jin calling from military on new year’s eve, bigbang’s taeyang confirms jimin collab? january just became one of our favourite months of this year as a new collaboration was announced  bigbang fame, member taeyang revealed and confirmed his upcoming song with jimin of bts and the fans of the two cannot stay calm  here are all the details we know so far 

taeyang x jimin

on january 4, bigbang&rsquo;s taeyang released a new teaser photo on his social media accounts, announcing his upcoming release  to be called &lsquo;vibe&rsquo;, the song will drop on january 13 at 2 pm kst (10:30 am ist)  a collaboration between taeyang and bts&rsquo; jimin, it is the first time that the members of the legendary groups are working together on a solo release &nbsp;

vibe teaser poster

the teaser poster shared by taeyang opens up in a yellow light setting where the two icons stand exuding their ever present charisma  the bigbang member, slightly bent from his waist is clad in a sleeveless jacket with multiple accessories around his neck and hands  his newly debuted long blonde hair is slicked back and it is one of the finest avatars we have seen him in &nbsp;

bts member jimin stands just behind him, propped on foot  jimin&rsquo;s usual sensual presence is just as visible in this photo as he wears a shining leather jacket, loose black pants and chunky boots  the red and black theme is common on both the artists &nbsp;
possibly, one of the most shocking collaborations to ever happen in the history of k-pop, &lsquo;vibe&rsquo; marks the amalgamation of the long-riding skills honed by bigbang and its members within its fandom ever since their debut in 2006 and adds the massive influence of bts and the septet&rsquo;s individual talents since their debut in 2013 to bring forth a groundbreaking release that will definitely make for a drop being talked about for years to come &nbsp;

taeyang&rsquo;s change to theblacklabel

bigbang member taeyang recently announced his departure from his origin agency, yg entertainment, with whom he trained and debuted  taeyang decided to move to theblacklabel, the subsidiary agency of yg entertainment and revealed that he will continue to be a part of bigbang&rsquo;s future group activities  his move comes at a time when the renewal of contracts of the group&rsquo;s members is being discussed and with daesung also deciding to leave their parent company, now only the leader, g-dragon remains 

as soon as he shifted to his new agency, taeyang revealed new profile photos which were also shared by him on his social media  he sported the same look as in the image for &lsquo;vibe&rsquo;, making fans anticipate his upcoming release 

                                                                                    
                                                                                taeyang teasing about vibe

it was in early december of 2022, that the reports about taeyang working with bts member jimin first broke out  while many found it hard to believe their eyes, others celebrated this unforgettable collaboration that was seemingly in the works  at the time, yg entertainment responded with no confirmation and only asked fans to stay excited about the soloist&rsquo;s upcoming activities &nbsp;

&nbsp;

just as his agency change was announced, taeyang took to his instagram to share a couple of photos  captioning them &lsquo;#2023&rsquo;, it was obvious that the singer was raising the hype meter for his release  however, there was another person in the photos whose back was to the camera  netizens turned on their detective sides and were quick to figure out that it was none other than bts&rsquo; jimin thanks to his hairstyle and adorable hands  the single was as good as confirmed now  to add to that, bts member j-hope clicked a like on the photo, which further solidified the fans&rsquo; thoughts &nbsp;

g-dragon&rsquo;s support

always the one to hype up his fellow members, bigbang leader g-dragon shared a story on his instagram account with theblacklabel&rsquo;s announcement of their new artist  he added a photo of himself and taeyang to the mix, celebrating his fellow duo member&rsquo;s new start 
https://twitter com/fairyyeji_/status/1610383311834349568daesung&rsquo;s letter&nbsp;

on the other hand, member daesung who decided to leave yg entertainment is yet to confirm his new agency  he wrote a handwritten letter to the label that has been with him right from the start and through all the highs and lows of his career so far and shared the letter through a video on his youtube channel  he also added that &lsquo;bigbang is forever&rsquo;, confirming his participation in the group 
we5rxm4obgkjimin of bts

this is not the first time that jimin is collaborating with an artist outside of bts  he has previously released a song, &lsquo;with you&rsquo;, with close friend ha sung woon which was used as one of the osts for the k-drama &lsquo;our blues&rsquo;  he has also previously released solo songs, including those in bts albums as well as &lsquo;promise&rsquo; which was a gift for his fans 

&lsquo;vibe&rsquo; drops on january 13 and we are so ready for it!",0.5640194445649862
