Index,Original Content,New Content,Removed Lines,ROUGE-1
102,"BTS members - Taehyung, Suga, RM, Jin, J-Hope, Jimin, and Jungkook, are making news every day for various reasons. Be it for their solo tracks or their group projects and more, BTS may have taken a break, but it seems like less of a break. After J-Hope stunning everyone with his hair extensions on the W Korea's cover and winning hearts with his Arson teaser, BTS V aka Kim Taehyung and Suga aka Min Yoongi have grabbed headlines. And it is for the most adorable video of TaeGi bond! There are also rumours of Taehyung and Suga flying to Japan So, a video of BTS aka Bangtan Boys - Taehyung and Suga is going viral. An ARMY had shared an edited video in which the two members of the most popular boyband are seen bonding over food. Both Suga and Taehyung are seen feeding each other and sharing food. It's one of the most heart-warming videos ever. In one of the clips that have been compiled by the BTS ARMY, we can see Suga giving the bigger piece of eatables BTS ARMY is currently tripping over Suga and Taehyung's bond. The video is going viral and everyone is crushing over how Taehyung and Suga are both feeding each other and looking out for each other. There are also rumours of Suga and V aka Min Yoongi and Kim Taehyung flying to Japan Taehyung and Suga both are Daegu kids. They have a very Tom-Jerry-ish bond. Suga is not the most physically clingy kind while Taehyung showers his affections with physical gestures such as hugs, holding hands, chin flicks and more. There's a misconception that they don't get along but the video above proves otherwise Suga is working on something but there are no details as of yet. He is the surprising kind. During the Festa dinner, Jungkook, however, confirmed that Suga is working on something. Moreover, there's a hint about Suga working with Jimin on a project. Nothing has been confirmed yet Taetae will be seen bonding with his Wooga Squad - Park Seojoon, Peakboy, Park Hyunsik and Choi Woo Shik in the Friendcation for In The Soop. The teasers and posters of In The Soop Friendcation are out already. In The Soop Friendcation will streaming on Disney Plus Hotstar from 22nd January, every Fridays at 11 PM KST. There are going to be four episodes of In The Soop Friendcation.  He is also working on his album. Taehyung in his drive vlog had revealed that he had scraped a lot of his songs because he felt they were not good enough Meanwhile, there are rumours that Taehyung and Suga will soon be flying to Japan. However, nothing has been confirmed. There are also rumours about Jungkook flying to the US for a schedule","there are also rumours of taehyung and suga flying to japan so, a video of bts aka bangtan boys - taehyung and suga is going viral. there are also rumours of suga and v aka min yoongi and kim taehyung flying to japan taehyung and suga both are daegu kids. after j-hope stunning everyone with his hair extensions on the w korea's cover and winning hearts with his arson teaser, bts v aka kim taehyung and suga aka min yoongi have grabbed headlines. in one of the clips that have been compiled by the bts army, we can see suga giving the bigger piece of eatables bts army is currently tripping over suga and taehyung's bond. taehyung in his drive vlog had revealed that he had scraped a lot of his songs because he felt they were not good enough meanwhile, there are rumours that taehyung and suga will soon be flying to japan. bts members - taehyung, suga, rm, jin, j-hope, jimin, and jungkook, are making news every day for various reasons.","both suga and taehyung are seen feeding each other and sharing food. there's a misconception that they don't get along but the video above proves otherwise suga is working on something but there are no details as of yet. an army had shared an edited video in which the two members of the most popular boyband are seen bonding over food. in the soop friendcation will streaming on disney plus hotstar from 22nd january, every fridays at 11 pm kst. the video is going viral and everyone is crushing over how taehyung and suga are both feeding each other and looking out for each other. and it is for the most adorable video of taegi bond! he is also working on his album. however, nothing has been confirmed. there are going to be four episodes of in the soop friendcation. nothing has been confirmed yet taetae will be seen bonding with his wooga squad - park seojoon, peakboy, park hyunsik and choi woo shik in the friendcation for in the soop. suga is not the most physically clingy kind while taehyung showers his affections with physical gestures such as hugs, holding hands, chin flicks and more. he is the surprising kind. the teasers and posters of in the soop friendcation are out already. it's one of the most heart-warming videos ever. moreover, there's a hint about suga working with jimin on a project. there are also rumours about jungkook flying to the us for a schedule during the festa dinner, jungkook, however, confirmed that suga is working on something. be it for their solo tracks or their group projects and more, bts may have taken a break, but it seems like less of a break. they have a very tom-jerry-ish bond.",0.44837757686758734
439,"BTS member J-Hope unveiled his personalised merch for ARMY, fandom of the group, on Tuesday  As part of his Artist-made Collection, J-Hope launched Hope pot set and a side-by-side mini bag  Both the products have hidden meanings in them In the video, released on Weverse and VLive, BTS' J-Hope told host and group member Jin that the Hope pot set comes with four small planters and the owner can grow any plant of their choice  J-Hope didn't divulge the engraving on the pots but said that he tried to convey a message  ""Even when I'm not around or out of sight, I'll always be by your side,"" he said On Twitter, fans cracked the message  A Twitter account named J-Hope pics, shared a bunch of pictures decoding the message on the pot and the meaning behind the bag  A photo shared in the tweet read, ""Hoseok's pots say his lyrics from Magic Shop: Like a rose when it blooms, Like a cherry blossom when it scatters, Like a morning glory when it withers, Like those beautiful moments "" The netizen captioned the post, ""Hobi’s hope pot set with his magic shop lyrics and mini bag is like blue side ""Another fan tweeted, ""Hobi's merch is 'H (heart emoji) PE' shaped plant pot with magic shop lyrics written in his handwriting "" ""Hobi put magic shop’s lyrics onto the pots oh my god it’s so pretty,"" said another Twitter user In the video, J-Hope spoke about his bag saying that he put his ‘heart and soul into designing’ it  The BTS member called his bag fashionable and practical  Reacting to his bag, a Twitter user wrote, ""Hobi used Blue Side as the concept of his mini side-by-side bag """"The design of Hobi’s mini bag being inspired by his track Blue Side hence its shade of blue and named side-by-side”  His music truly transcends all forms of artistic creation,"" said another fan  ""It was used to display Taehyung's merch right in front of our eyes,"" tweeted another person In the video, V and Jungkook posed as the models of the bag  The duo made goofy poses and pretended to work out as well and pose like athletes as they showed off the bag As the duo started taking out stuff from the bag in a funny manner, J-Hope said, ""This is like the scene from a comic book "" Later V and Jimin also stood like mannequins as J-Hope and Jin explained to viewers the products  At the end of the video, J-Hope revealed that the engravings on the pots were from the track Magic Shop Also Read | BTS' RM, Jin, J-Hope, Jungkook celebrate reunion with Korean snacks and sing Super Tuna; ARMY miss Suga, Jimin, V  WatchOn Twitter, reacting to Jimin and V's antics, a fan wrote, ""Either vmin are the mannequins or the kids, it still works, amazing "" ""These QVC models are killing me with their 'unconventional poses',"" said another fan  A Twitter user wrote, ""Why do models even try when vmin exist?"" ""There’s never a dull moment with vmin,"" said another fan","bts member j-hope unveiled his personalised merch for army, fandom of the group, on tuesday  as part of his artist-made collection, j-hope launched hope pot set and a side-by-side mini bag  both the products have hidden meanings in them in the video, released on weverse and vlive, bts' j-hope told host and group member jin that the hope pot set comes with four small planters and the owner can grow any plant of their choice  j-hope didn't divulge the engraving on the pots but said that he tried to convey a message  ""even when i'm not around or out of sight, i'll always be by your side,"" he said on twitter, fans cracked the message  a twitter account named j-hope pics, shared a bunch of pictures decoding the message on the pot and the meaning behind the bag  a photo shared in the tweet read, ""hoseok's pots say his lyrics from magic shop: like a rose when it blooms, like a cherry blossom when it scatters, like a morning glory when it withers, like those beautiful moments "" the netizen captioned the post, ""hobi’s hope pot set with his magic shop lyrics and mini bag is like blue side ""another fan tweeted, ""hobi's merch is 'h (heart emoji) pe' shaped plant pot with magic shop lyrics written in his handwriting "" ""hobi put magic shop’s lyrics onto the pots oh my god it’s so pretty,"" said another twitter user in the video, j-hope spoke about his bag saying that he put his ‘heart and soul into designing’ it  the bts member called his bag fashionable and practical  reacting to his bag, a twitter user wrote, ""hobi used blue side as the concept of his mini side-by-side bag """"the design of hobi’s mini bag being inspired by his track blue side hence its shade of blue and named side-by-side”  his music truly transcends all forms of artistic creation,"" said another fan  ""it was used to display taehyung's merch right in front of our eyes,"" tweeted another person in the video, v and jungkook posed as the models of the bag  the duo made goofy poses and pretended to work out as well and pose like athletes as they showed off the bag as the duo started taking out stuff from the bag in a funny manner, j-hope said, ""this is like the scene from a comic book "" later v and jimin also stood like mannequins as j-hope and jin explained to viewers the products  at the end of the video, j-hope revealed that the engravings on the pots were from the track magic shop also read | bts' rm, jin, j-hope, jungkook celebrate reunion with korean snacks and sing super tuna; army miss suga, jimin, v  watchon twitter, reacting to jimin and v's antics, a fan wrote, ""either vmin are the mannequins or the kids, it still works, amazing "" ""these qvc models are killing me with their 'unconventional poses',"" said another fan  a twitter user wrote, ""why do models even try when vmin exist?""","""there’s never a dull moment with vmin,"" said another fan",0.7840290331184682
273,"In the over 12 minute-long video, several old clips of BTS members exercising, talking about the importance of workouts and goofing around were included. However, none of the members--RM, Jin, Suga, J-Hope, Jimin, V and Jungkook, took part in the new video. Earlier, when HYBE spoke about their Workout with BTS project, fans thought that the members will share their fitness routines. However, in the new video, between the old clips of the members, a fitness trainer was seen teaching exercises to ARMY to keep themselves fit. Workout with BTS is a five-day fitness program, part of BTS’ educational projects with HYBE EDU. Taking to Twitter, upset ARMY expressed their views on the video. Reacting to HYBE's tweet, a fan commented, ""Yes!! This is how our expectations fall from the 7th sky."" ""Using my man as a clickbait...ugh,"" tweeted another person. ""I feel betrayed,"" wrote another fan. ""We all thought workout with BTS would be BTS themselves demonstrating the exercise,"" said another person. A fan asked, ""Where's BTS where's my boys big hit are you serious where's my dream?"" A person tweeted, ""The exercise routine is so beautiful, I liked how they explained to us step by step how much we should do each exercise, it's so nice to see that they care about our health, so let's take these data into account, the boys are so cute."" ""I thought they will teach us recording their workout session and I thought of drooling over them instead of working out and burn my fat seeing their hotness. You flipped the table,"" wrote a Twitter user. ""Bighit staff laughing at armys and their expectations right now,"" said a fan. Meanwhile, BTS members will release their new album on June 10 this year. BTS recently wrapped their four concerts in Las Vegas, US.","""we all thought workout with bts would be bts themselves demonstrating the exercise,"" said another person. a person tweeted, ""the exercise routine is so beautiful, i liked how they explained to us step by step how much we should do each exercise, it's so nice to see that they care about our health, so let's take these data into account, the boys are so cute."" workout with bts is a five-day fitness program, part of bts’ educational projects with hybe edu. earlier, when hybe spoke about their workout with bts project, fans thought that the members will share their fitness routines.","bts recently wrapped their four concerts in las vegas, us. ""i thought they will teach us recording their workout session and i thought of drooling over them instead of working out and burn my fat seeing their hotness. ""i feel betrayed,"" wrote another fan. you flipped the table,"" wrote a twitter user. meanwhile, bts members will release their new album on june 10 this year. ""bighit staff laughing at armys and their expectations right now,"" said a fan. however, none of the members--rm, jin, suga, j-hope, jimin, v and jungkook, took part in the new video. in the over 12 minute-long video, several old clips of bts members exercising, talking about the importance of workouts and goofing around were included. this is how our expectations fall from the 7th sky."" a fan asked, ""where's bts where's my boys big hit are you serious where's my dream?"" taking to twitter, upset army expressed their views on the video. reacting to hybe's tweet, a fan commented, ""yes!! ""using my man as a clickbait...ugh,"" tweeted another person. however, in the new video, between the old clips of the members, a fitness trainer was seen teaching exercises to army to keep themselves fit.",0.5055762041243211
106,"BTS ARMY is one helluva massive ARMY with a writer in each one of them all ready with their fan fics. Well, BTS AU is quite popular online and especially between biased shippers. And we came across some BTS ARMYs going crazy mad over one of the fan fiction that was written in 2018. What would be so special about the BTS fan fiction written in 2018? There seems to be a mention of hiatus in 2022! Yes, you read that right! Someone predicted BTS alleged 'hiatus' (read breaking from back-to-back activities) in 2018 and it has all come true This BTS fan fiction is going viral in Hollywood News right now. So someone wrote a Taekook fan fiction. And it includes the details of the 2020 album and the massive success of BTS. Thereafter, the BTS fan fiction also talks about the concerts and how they are tired after working nonstop and very hard for 9 years. The BTS AU is quite shocking as it was written in 2018 while talking about 2020 and 2022 The predictions have left the BTS ARMY in a tizzy. They are especially going bonkers over the bang-on prediction of a break from activities. Some of the ARMYs are wondering who is this time travelling fan fiction writer while some wonder if it's Suga aka Min Yoongi. Check out BTS ARMY's reaction to the BTS AU fan fiction here: Talking about the break from constant group activities, the BTS members will now be focussing a lot more on their solo careers. It does not mean that the band has disbanded. In mid-October, Big Hit Music announced that the BTS members will be going forward with their military enlistment starting with Kim Seokjin aka Jin","and we came across some bts armys going crazy mad over one of the fan fiction that was written in 2018. what would be so special about the bts fan fiction written in 2018? check out bts army's reaction to the bts au fan fiction here: talking about the break from constant group activities, the bts members will now be focussing a lot more on their solo careers. someone predicted bts alleged 'hiatus' (read breaking from back-to-back activities) in 2018 and it has all come true this bts fan fiction is going viral in hollywood news right now.","in mid-october, big hit music announced that the bts members will be going forward with their military enlistment starting with kim seokjin aka jin what would be so special about the bts fan fiction written in 2018? some of the armys are wondering who is this time travelling fan fiction writer while some wonder if it's suga aka min yoongi. bts army is one helluva massive army with a writer in each one of them all ready with their fan fics. the bts au is quite shocking as it was written in 2018 while talking about 2020 and 2022 the predictions have left the bts army in a tizzy. and we came across some bts armys going crazy mad over one of the fan fiction that was written in 2018. yes, you read that right! and it includes the details of the 2020 album and the massive success of bts. thereafter, the bts fan fiction also talks about the concerts and how they are tired after working nonstop and very hard for 9 years. so someone wrote a taekook fan fiction. well, bts au is quite popular online and especially between biased shippers. they are especially going bonkers over the bang-on prediction of a break from activities. there seems to be a mention of hiatus in 2022! it does not mean that the band has disbanded.",0.5228215726072211
71,"The teaser, titled ""Run BTS! 2022 Special Episode - Telepathy Part 0,"" started with the game's coordinator asking the members, ""This may not even need to be asked, but how well do you know your members?"" Jin confidently replied, ""Very well, of course. There's nothing we don't know."" J-Hope added to this, ""We've been together for so many years. We're one in body and soul."" Suga said, ""What do you take us for?"" However, the band shared some laughs as they failed to answer trivia questions about each other while their new song also titled Run BTS played in the background. RM said, ""This is driving me crazy,"" while V cluelessly asked at one point, ""What does that mean?"" During one of the questions, Jungkook tried to search his memories for the answer, but then conceded defeat and said, ""We were seriously never good at this."" After giving a wrong answer, Jimin asked, ""It's not this?"" At another point, Jungkook got upset after one of his bandmates got something wrong about him, and complained, ""How can you not know this?"" As soon as the teaser was dropped, it created confusion for BTS' fans as its title suggested that it was the full episode instead of a 41-second teaser. Other fans called the programme therapy for them. One tweeted, ""My happy pills,"" while another wrote, ""Therapy is coming back for real."" A third one tweeted, ""Thank you for going against the healthcare system and making therapy free."" Run BTS, which shows the BTS members having fun as they indulge in some friendly competitions, is coming back after a gap of 10 months. The episode will be released on Weverse, VLive, and YouTube on August 16.","2022 special episode - telepathy part 0,"" started with the game's coordinator asking the members, ""this may not even need to be asked, but how well do you know your members?"" run bts, which shows the bts members having fun as they indulge in some friendly competitions, is coming back after a gap of 10 months. however, the band shared some laughs as they failed to answer trivia questions about each other while their new song also titled run bts played in the background. at another point, jungkook got upset after one of his bandmates got something wrong about him, and complained, ""how can you not know this?""","j-hope added to this, ""we've been together for so many years. after giving a wrong answer, jimin asked, ""it's not this?"" we're one in body and soul."" during one of the questions, jungkook tried to search his memories for the answer, but then conceded defeat and said, ""we were seriously never good at this."" other fans called the programme therapy for them. as soon as the teaser was dropped, it created confusion for bts' fans as its title suggested that it was the full episode instead of a 41-second teaser. jin confidently replied, ""very well, of course. the episode will be released on weverse, vlive, and youtube on august 16. rm said, ""this is driving me crazy,"" while v cluelessly asked at one point, ""what does that mean?"" suga said, ""what do you take us for?"" there's nothing we don't know."" a third one tweeted, ""thank you for going against the healthcare system and making therapy free."" the teaser, titled ""run bts! one tweeted, ""my happy pills,"" while another wrote, ""therapy is coming back for real.""",0.5498281744216531
704,"We are back with your daily dose of Hollywood updates. Among the biggest newsmaker, K-pop boy band BTS member RM grabbed maximum attention as he had a 1 AM chat with his fans. He was asked about his upcoming mixtape to which he stated that it is half done. He also dished out some breakfast recommendations for his fans Lili Reinhart seemingly called out Kim Kardashian for talking about losing weight for her Met Gala 2022 appearance. Kim shed like almost 7 kilos in 3 weeks to slip into the golden dress. On her Insta stories, Lili wrote, 'To walk on a red carpet and do an interview where you say how starving you are. because you haven't eaten carbs in the last month.all to fit in a f*****g dress? So wrong. So f****d on 100s of levels In a latest social media post, Britney Spears mentioned how her father messed up with her confidence. She wrote, 'My dad always made me feel like I had to try … try … try !!! BIG TIME !!!” she continued. “He ruined the deep seed of my existence … the seed that made me feel beautiful like when I was 13 … my confidence … my swag … my inner dialogue … and yes even my sex life … all completely ruined !!!' In an interview with Apple Music's Ebro Darden, Justin Bieber revealed how he had gone through an emotional breakdown post his wedding with Hailey Bieber. 'I remember when I first got married, I hit a little bit of an emotional breakdown because I thought marriage was going to fix all my problems and it didn't. It just kind of was a reflection of like, man, you're a bit of a hypocrite man,' he was quoted saying as reported by PEOPLE While the trial is on in the defamation case filed by Johnny Depp against Amber Heard, it is reported that the actress' lawyer requested the judge to dismiss the case. As per Variety, the lawyers mentioned that Depp's attorneys had failed to present enough evidence to prove their case. However, judge Penney Azcarate denied the motion","“he ruined the deep seed of my existence … the seed that made me feel beautiful like when i was 13 … my confidence … my swag … my inner dialogue … and yes even my sex life … all completely ruined !!!' it just kind of was a reflection of like, man, you're a bit of a hypocrite man,' he was quoted saying as reported by people while the trial is on in the defamation case filed by johnny depp against amber heard, it is reported that the actress' lawyer requested the judge to dismiss the case. she wrote, 'my dad always made me feel like i had to try … try … try !!! he also dished out some breakfast recommendations for his fans lili reinhart seemingly called out kim kardashian for talking about losing weight for her met gala 2022 appearance.","so wrong. however, judge penney azcarate denied the motion we are back with your daily dose of hollywood updates. so f****d on 100s of levels in a latest social media post, britney spears mentioned how her father messed up with her confidence. in an interview with apple music's ebro darden, justin bieber revealed how he had gone through an emotional breakdown post his wedding with hailey bieber. 'i remember when i first got married, i hit a little bit of an emotional breakdown because i thought marriage was going to fix all my problems and it didn't. on her insta stories, lili wrote, 'to walk on a red carpet and do an interview where you say how starving you are. !” she continued. among the biggest newsmaker, k-pop boy band bts member rm grabbed maximum attention as he had a 1 am chat with his fans. kim shed like almost 7 kilos in 3 weeks to slip into the golden dress. as per variety, the lawyers mentioned that depp's attorneys had failed to present enough evidence to prove their case. he was asked about his upcoming mixtape to which he stated that it is half done. because you haven't eaten carbs in the last month.all to fit in a f*****g dress? big time !!",0.5120481885614748
