Index,Original Content,New Content,Removed Lines,ROUGE-1
417,"Bangchan or Christopher Bang was born on October 3, 1997 in Seoul, South Korea. He is the leader, producer, songwriter, composer, lead vocalist, rapper and dancer of Stray Kids. In 2010, at the age of 13, he passed a local audition in Australia for the K-pop label JYP Entertainment. Despite his young age, he moved to Korea to train at JYPE. Today's heartwarming letter in our Dear Oppa series has been penned by Shruti from India to Stray Kids’ Bangchan. Read her letter below.Dear Bang Chan,I  still vividly remember the first video that made me a fan of yours. Even though it's the 21st century, talking about periods is not something what many men do, leave alone a male kpop idol. But YOU did. Fearlessly! Not caring about how controversial it might turn out to be. Little did I know that one video would change my life for the better. From being a naive 13 year old teen who left his country and trained hard for 7 years to becoming the leader of one of the most popular 4th Gen groups, you've proved time and again that you're indeed the ""best leader"". Your genius and talent never ceases to amaze and inspire me. The dedication you have towards your profession, your members and your fans is everything. ""Chan's Room"" has now become a comfort place for me and I would be lying if I say I do not wait for the weekends for those ""big hugs"". If I had to name one thing that I learned from you then that would be ""kindness"". The way you genuinely care for every single individual around you, make them feel comfortable and most importantly put them before yourself, not only shows your big heart but also how compassionate you are as a person. From encouraging us to be proud of the little demon that resides within us to comforting us by saying it's okay to cry and let it out to giving tips on how to deal with stress and anxiety, you've truly been a Guardian angel for us Stays. Honestly, I could go on talking about how much your kindness has given me the strength to endure these hard times, not just me but Stays and every other person who looks up to you. I truly hope that the next time you take a Buzzfeed quiz, the answer to ""Do you love yourself?"" would be a genuine YES accompanied with that dimpled smile. Sending you lots of warm hugs and hot chocolate. Till the last ""STEP OUT""!Love,ShrutiIndiaALSO READ: The World of the Married’s Park Hae Joon molds into a jobless comic writer in new posters for upcoming dramaThe magnificent celebration of K-world culminates with The HallyuTalk Awards, watch here.Want to let out in words, your undying fondness for your favourite K-drama and K-pop stars? Email your open letter to: editorial@pinkvilla.com, mentioning your full name, country, IG handle and Twitter handle. The opportunity is open to readers from across the globe. Your letters may also feature on our official Instagram page Hallyutalk as well so don't forget to follow us there! Disclaimer: This is user-generated content. The views and opinions expressed in this letter are those of the author.","from encouraging us to be proud of the little demon that resides within us to comforting us by saying it's okay to cry and let it out to giving tips on how to deal with stress and anxiety, you've truly been a guardian angel for us stays. till the last ""step out""!love,shrutiindiaalso read: the world of the married’s park hae joon molds into a jobless comic writer in new posters for upcoming dramathe magnificent celebration of k-world culminates with the hallyutalk awards, watch here.want to let out in words, your undying fondness for your favourite k-drama and k-pop stars? from being a naive 13 year old teen who left his country and trained hard for 7 years to becoming the leader of one of the most popular 4th gen groups, you've proved time and again that you're indeed the ""best leader"". the way you genuinely care for every single individual around you, make them feel comfortable and most importantly put them before yourself, not only shows your big heart but also how compassionate you are as a person. honestly, i could go on talking about how much your kindness has given me the strength to endure these hard times, not just me but stays and every other person who looks up to you. email your open letter to: editorial@pinkvilla.com, mentioning your full name, country, ig handle and twitter handle. your letters may also feature on our official instagram page hallyutalk as well so don't forget to follow us there!","little did i know that one video would change my life for the better. today's heartwarming letter in our dear oppa series has been penned by shruti from india to stray kids’ bangchan. if i had to name one thing that i learned from you then that would be ""kindness"". sending you lots of warm hugs and hot chocolate. bangchan or christopher bang was born on october 3, 1997 in seoul, south korea. he is the leader, producer, songwriter, composer, lead vocalist, rapper and dancer of stray kids. despite his young age, he moved to korea to train at jype. in 2010, at the age of 13, he passed a local audition in australia for the k-pop label jyp entertainment. even though it's the 21st century, talking about periods is not something what many men do, leave alone a male kpop idol. the dedication you have towards your profession, your members and your fans is everything. your genius and talent never ceases to amaze and inspire me. the opportunity is open to readers from across the globe. read her letter below.dear bang chan,i  still vividly remember the first video that made me a fan of yours. fearlessly! not caring about how controversial it might turn out to be. i truly hope that the next time you take a buzzfeed quiz, the answer to ""do you love yourself?"" would be a genuine yes accompanied with that dimpled smile. the views and opinions expressed in this letter are those of the author. but you did. ""chan's room"" has now become a comfort place for me and i would be lying if i say i do not wait for the weekends for those ""big hugs"". disclaimer: this is user-generated content.",0.5850860375748093
809,"After a lot of teasing, Benny Blanco’s collaborative song with BTS and Snoop Dogg is finally here! ‘Bad Decisions’ features BTS’ vocal line members Jin, Jimin, V and Jungkook along with rapper Snoop Dogg, and is a pre-release single from Benny Blanco’s upcoming full-length album  Released on August 5 at 9:30 am IST, the light beat of ‘Bad Decisions’ becomes the perfect background for its lyrics that express honest feelings to a loved person  The dance track carries a cool feeling, which helps the listener feel refreshed on a hot summer day Meanwhile, the hilarious music video sees Benny Blanco getting ready to attend a BTS concert, only to find out that he has got the date wrong, and to be told that he's made a ""bad decision""!Check out the fun music video for ‘Bad Decisions’, below: https://www youtube com/embed/BGNkkVrJZksPrior to the release, two music video teasers were dropped, adopting a style reminiscent of that of a movie trailer  With a classic narration accompanying BTS’ shots from their previous music video, the teasers hilariously teased the then-upcoming song, without actually giving away any hint about the song itself or its music video Further, Benny Blanco also kicked off a hunt for ‘Bad Decisions’, by sharing a video which showed him hiding a USB drive containing the song “somewhere in LA”  https://twitter com/ItsBennyBlanco/status/1555041143183708160?ref_src=twsrc%5EtfwThe next few hours saw ARMYs coming together to search for the USB drive, with #FindBadDecisions trending on Twitter  With an hour and a half to go before the song’s release, Benny Blanco took to Twitter again, this time dropping an address for the USB drive’s location, and asking fans to meet up there!From the teasers to a hunt for a USB drive and more, ‘Bad Decisions’ has been a series of chaotically fun events! Following today’s music video premiere and release of ‘Bad Decisions’ on streaming platforms, the lyric video of the song will be out on BTS’ YouTube channel tomorrow, at 9:30 am IST on August 6  This will be followed by a ‘Visualizer’ released through Benny Blanco’s YouTube channel on August 8, and the ‘BTS Recording Sketch’ video through BTS’ YouTube channel on August 16 What did you think about ‘Bad Decisions’? Share your thoughts with us through the comments! Join the biggest community of K-Pop fans live on Pinkvilla Rooms to get one step closer to your favourite K-Celebs! Click here to join  ALSO READ: TWICE drops exciting timetable for 11th mini album ‘BETWEEN 1&2’; Teases opening trailer, album preview & more","‘bad decisions’ features bts’ vocal line members jin, jimin, v and jungkook along with rapper snoop dogg, and is a pre-release single from benny blanco’s upcoming full-length album  released on august 5 at 9:30 am ist, the light beat of ‘bad decisions’ becomes the perfect background for its lyrics that express honest feelings to a loved person  the dance track carries a cool feeling, which helps the listener feel refreshed on a hot summer day meanwhile, the hilarious music video sees benny blanco getting ready to attend a bts concert, only to find out that he has got the date wrong, and to be told that he's made a ""bad decision""!check out the fun music video for ‘bad decisions’, below: https://www youtube com/embed/bgnkkvrjzksprior to the release, two music video teasers were dropped, adopting a style reminiscent of that of a movie trailer  with a classic narration accompanying bts’ shots from their previous music video, the teasers hilariously teased the then-upcoming song, without actually giving away any hint about the song itself or its music video further, benny blanco also kicked off a hunt for ‘bad decisions’, by sharing a video which showed him hiding a usb drive containing the song “somewhere in la”  https://twitter com/itsbennyblanco/status/1555041143183708160?ref_src=twsrc%5etfwthe next few hours saw armys coming together to search for the usb drive, with #findbaddecisions trending on twitter  with an hour and a half to go before the song’s release, benny blanco took to twitter again, this time dropping an address for the usb drive’s location, and asking fans to meet up there!from the teasers to a hunt for a usb drive and more, ‘bad decisions’ has been a series of chaotically fun events!","join the biggest community of k-pop fans live on pinkvilla rooms to get one step closer to your favourite k-celebs! share your thoughts with us through the comments! after a lot of teasing, benny blanco’s collaborative song with bts and snoop dogg is finally here! ‘bad decisions’ features bts’ vocal line members jin, jimin, v and jungkook along with rapper snoop dogg, and is a pre-release single from benny blanco’s upcoming full-length album  released on august 5 at 9:30 am ist, the light beat of ‘bad decisions’ becomes the perfect background for its lyrics that express honest feelings to a loved person  the dance track carries a cool feeling, which helps the listener feel refreshed on a hot summer day meanwhile, the hilarious music video sees benny blanco getting ready to attend a bts concert, only to find out that he has got the date wrong, and to be told that he's made a ""bad decision""!check out the fun music video for ‘bad decisions’, below: https://www youtube com/embed/bgnkkvrjzksprior to the release, two music video teasers were dropped, adopting a style reminiscent of that of a movie trailer  with a classic narration accompanying bts’ shots from their previous music video, the teasers hilariously teased the then-upcoming song, without actually giving away any hint about the song itself or its music video further, benny blanco also kicked off a hunt for ‘bad decisions’, by sharing a video which showed him hiding a usb drive containing the song “somewhere in la”  https://twitter com/itsbennyblanco/status/1555041143183708160?ref_src=twsrc%5etfwthe next few hours saw armys coming together to search for the usb drive, with #findbaddecisions trending on twitter  with an hour and a half to go before the song’s release, benny blanco took to twitter again, this time dropping an address for the usb drive’s location, and asking fans to meet up there!from the teasers to a hunt for a usb drive and more, ‘bad decisions’ has been a series of chaotically fun events! following today’s music video premiere and release of ‘bad decisions’ on streaming platforms, the lyric video of the song will be out on bts’ youtube channel tomorrow, at 9:30 am ist on august 6  this will be followed by a ‘visualizer’ released through benny blanco’s youtube channel on august 8, and the ‘bts recording sketch’ video through bts’ youtube channel on august 16 what did you think about ‘bad decisions’? click here to join  also read: twice drops exciting timetable for 11th mini album ‘between 1&2’; teases opening trailer, album preview & more",0.7064220134926564
389,"On August 18, it was confirmed that BTS have become the first male artist to surpass 70 million subscribers on YouTube, beating American artist Justin Bieber who has 69 8 million subscribers  Previously, BLACKPINK crossed the same threshold in November, 2021  They also beat Justin Bieber and became the artist with the most views across all their official channels on the platform  In other news, Blanco's 'Bad Decision', voiced by BTS members Jin, Jimin, V, and Jungkook, was such a hit in this week's 'Hot 100'  Billboard explained, ""In the first week of release, 'Bad Decision' was streamed 10 1 million times  The number of digital downloads and CD/cassette sales were 66,000 "" With this, BTS became the first Korean artist to list more than 10 songs on the Billboard 'Hot 100' Top 10 Earlier, BTS started with 'Dynamite' in 2020, followed by 'Savage Love' remix, 'Life Go's On', 'Butter', 'Permission to Dance', and 'My Universe' in collaboration with Britpop band 'Coldplay'  The song was placed at number one There are only 5 hotshots that debuted at number one at the same time as the double announcement In addition, 'On' has 4th place, 'Boy With Luv' 8th, and 'Fake Love' 10th, etc Along with ‘Bad Decisions’ also topped the Billboard detailed charts this week  In 'Digital Song Sales', it immediately took first place as it entered the chart It ranked 6th and 7th respectively on the 'Billboard Global 200' and 'Billboard Global (excluding the US)'  Earlier, this song debuted at #53 on the latest chart (August 12-18) of the UK's official single chart 'Top 100', which is known as one of the world's two largest pop charts along with Billboard ALSO READ: BLACKPINK drops new poster for ‘Pink Venom’; Announces intriguing campaignJoin the biggest community of K-Pop fans live on Pinkvilla Rooms to get one step closer to your favourite K-Celebs! Click here to join   What do you think of the achievement? Let us know in the comments below  ","on august 18, it was confirmed that bts have become the first male artist to surpass 70 million subscribers on youtube, beating american artist justin bieber who has 69 8 million subscribers  previously, blackpink crossed the same threshold in november, 2021  they also beat justin bieber and became the artist with the most views across all their official channels on the platform  in other news, blanco's 'bad decision', voiced by bts members jin, jimin, v, and jungkook, was such a hit in this week's 'hot 100'  billboard explained, ""in the first week of release, 'bad decision' was streamed 10 1 million times  the number of digital downloads and cd/cassette sales were 66,000 "" with this, bts became the first korean artist to list more than 10 songs on the billboard 'hot 100' top 10 earlier, bts started with 'dynamite' in 2020, followed by 'savage love' remix, 'life go's on', 'butter', 'permission to dance', and 'my universe' in collaboration with britpop band 'coldplay'  the song was placed at number one there are only 5 hotshots that debuted at number one at the same time as the double announcement in addition, 'on' has 4th place, 'boy with luv' 8th, and 'fake love' 10th, etc along with ‘bad decisions’ also topped the billboard detailed charts this week  in 'digital song sales', it immediately took first place as it entered the chart it ranked 6th and 7th respectively on the 'billboard global 200' and 'billboard global (excluding the us)'  earlier, this song debuted at #53 on the latest chart (august 12-18) of the uk's official single chart 'top 100', which is known as one of the world's two largest pop charts along with billboard also read: blackpink drops new poster for ‘pink venom’; announces intriguing campaignjoin the biggest community of k-pop fans live on pinkvilla rooms to get one step closer to your favourite k-celebs!","on august 18, it was confirmed that bts have become the first male artist to surpass 70 million subscribers on youtube, beating american artist justin bieber who has 69 8 million subscribers  previously, blackpink crossed the same threshold in november, 2021  they also beat justin bieber and became the artist with the most views across all their official channels on the platform  in other news, blanco's 'bad decision', voiced by bts members jin, jimin, v, and jungkook, was such a hit in this week's 'hot 100'  billboard explained, ""in the first week of release, 'bad decision' was streamed 10 1 million times  the number of digital downloads and cd/cassette sales were 66,000 "" with this, bts became the first korean artist to list more than 10 songs on the billboard 'hot 100' top 10 earlier, bts started with 'dynamite' in 2020, followed by 'savage love' remix, 'life go's on', 'butter', 'permission to dance', and 'my universe' in collaboration with britpop band 'coldplay'  the song was placed at number one there are only 5 hotshots that debuted at number one at the same time as the double announcement in addition, 'on' has 4th place, 'boy with luv' 8th, and 'fake love' 10th, etc along with ‘bad decisions’ also topped the billboard detailed charts this week  in 'digital song sales', it immediately took first place as it entered the chart it ranked 6th and 7th respectively on the 'billboard global 200' and 'billboard global (excluding the us)'  earlier, this song debuted at #53 on the latest chart (august 12-18) of the uk's official single chart 'top 100', which is known as one of the world's two largest pop charts along with billboard also read: blackpink drops new poster for ‘pink venom’; announces intriguing campaignjoin the biggest community of k-pop fans live on pinkvilla rooms to get one step closer to your favourite k-celebs! click here to join   what do you think of the achievement? let us know in the comments below",0.6539379425065931
193,"In the first two pictures, J-Hope and J Cole are seen having a conversation and a laugh. The last photo showed J Cole standing with Jimin and J-Hope. In the pictures, J-Hope wore an all-white outfit while Jimin opted for a white T-shirt and denims. J Cole wore a black T-shirt and pants. All of them were having a fun time at the venue. Sharing the pictures, J-Hope captioned the post, ""Hope world meets cole world."" On his Instagram Stories, J-Hope posted a clip of Jimin at the event. In the brief video, Jimin at first posed with his identity card and flashed the victory sign giving a glimpse of his '7' tattoo. After being prompted by J-Hope, Jimin started dancing as the rapper cheered him up. Sharing the clip, J-Hope wrote, ""Love ma bro @j.m."" In another clip, J-hope and Jimin were seen dancing at the event. The two BTS members grooved to rapper Big Sean's songs. J-Hope simply posted the video and tagged the singer. Jimin and J-Hope also danced and cheered K-pop group TXT, who performed at the festival. On Twitter, TXT posted a photo of J-Hope and Taehyun posing together for a selfie. The caption read, ""With most cool guy in the world#JHOPE #TAEHYUN."" After their performance, TXT member Taehyun hosted a live session and spoke about J-Hope and Jimin attending the concert. He said, as translated by BTS fan account @Koo_Picasso on Twitter, “Today Jiminie hyung (elder brother) and Hoseokie hyung came. So we felt more energized, and it was totally the best."" J-Hope will perform at the concert on Sunday (July 31) at 9 pm CST (1 pm KST on August 1).","after their performance, txt member taehyun hosted a live session and spoke about j-hope and jimin attending the concert. in the pictures, j-hope wore an all-white outfit while jimin opted for a white t-shirt and denims. the last photo showed j cole standing with jimin and j-hope. jimin and j-hope also danced and cheered k-pop group txt, who performed at the festival. in the first two pictures, j-hope and j cole are seen having a conversation and a laugh.","the caption read, ""with most cool guy in the world#jhope #taehyun."" j-hope simply posted the video and tagged the singer. in the brief video, jimin at first posed with his identity card and flashed the victory sign giving a glimpse of his '7' tattoo. on twitter, txt posted a photo of j-hope and taehyun posing together for a selfie. sharing the clip, j-hope wrote, ""love ma bro @j.m."" so we felt more energized, and it was totally the best."" j-hope will perform at the concert on sunday (july 31) at 9 pm cst (1 pm kst on august 1). in another clip, j-hope and jimin were seen dancing at the event. the two bts members grooved to rapper big sean's songs. he said, as translated by bts fan account @koo_picasso on twitter, “today jiminie hyung (elder brother) and hoseokie hyung came. after being prompted by j-hope, jimin started dancing as the rapper cheered him up. all of them were having a fun time at the venue. j cole wore a black t-shirt and pants. on his instagram stories, j-hope posted a clip of jimin at the event. sharing the pictures, j-hope captioned the post, ""hope world meets cole world.""",0.4035874402758955
279,"Korean boy band BTS is popular across the globe. They have their fan base in almost every part of the world. Their fans are known as ARMY and everyday they get the band trending on Twitter. In India too, there are thousands and thousands of people who are in love with the K-pop band comprising of Jimin, Jin, Jungkook, J-Hope, Suga, RM, and V. But is Government putting a ban on the band in India because of its rising influence? A social media post has Indian fans of BTS in shock. But here is the truth Recently a post when viral on social media. It read, “The Government of India has banned the famous South Korean Band ‘BTS’ stating that their influence is threat to Indian Youth.” Further it read, “The Government also requested YouTube to restrict all the videos from the BTS band to be viewed in India. This is a very shocking decision Soon, fans of the Bangtan boys in India started expressing their concern. Many expressed that they got scared thinking it is true. However, that is not the case. BTS has not been banned in India as there no confirmation on an official on this. Even on YouTube there are videos calling out this piece of information of BTS ban in India fake For a long time now, BTS' fans in India have been rooting for the boy band to organise a concert in the country. a video of the boy band had recently gone viral on social media in which they had greeted Indian fans with a namaste","it read, “the government of india has banned the famous south korean band ‘bts’ stating that their influence is threat to indian youth.” further it read, “the government also requested youtube to restrict all the videos from the bts band to be viewed in india. even on youtube there are videos calling out this piece of information of bts ban in india fake for a long time now, bts' fans in india have been rooting for the boy band to organise a concert in the country. in india too, there are thousands and thousands of people who are in love with the k-pop band comprising of jimin, jin, jungkook, j-hope, suga, rm, and v. but is government putting a ban on the band in india because of its rising influence?","many expressed that they got scared thinking it is true. this is a very shocking decision soon, fans of the bangtan boys in india started expressing their concern. korean boy band bts is popular across the globe. however, that is not the case. but here is the truth recently a post when viral on social media. a social media post has indian fans of bts in shock. they have their fan base in almost every part of the world. a video of the boy band had recently gone viral on social media in which they had greeted indian fans with a namaste bts has not been banned in india as there no confirmation on an official on this. their fans are known as army and everyday they get the band trending on twitter.",0.5327510870814822
